{
  "$schema": "https://json-schema.org/draft/2020-12/schema",
  "$id": "https://software-quality-knowledge-base.example/schemas/test-case.schema.json",
  "title": "TestCase",
  "description": "正規出典: docs/test-techniques/test-process-research-summary-test-design.md §6.5 TestCase の JSON例。フィールド: id / coverage_item_refs[] / preconditions[] / test_data_refs[] / steps[] / expected_results[] / priority。id の桁数規約は §6.1 と docs/quality-models/quality-knowledge-schema.md §1.2 のいずれも厳密に規定していないため、緩い方（可変桁数）を採用した。",
  "type": "object",
  "properties": {
    "id": {
      "type": "string",
      "pattern": "^TC-[0-9]+$",
      "description": "テストケースの一意ID。出典: §6.1 基本ID体系表・§6.5 JSON例（`TC-001`）。桁数は出典で明記されていないため可変桁数を許容。"
    },
    "coverage_item_refs": {
      "type": "array",
      "items": { "type": "string" },
      "description": "対応するカバレッジアイテムID一覧（例: COV-001）。出典: §6.5 JSON例。"
    },
    "preconditions": {
      "type": "array",
      "items": { "type": "string" },
      "description": "実行前提条件一覧。出典: §6.5 JSON例。"
    },
    "test_data_refs": {
      "type": "array",
      "items": { "type": "string" },
      "description": "使用するテストデータID一覧（例: TD-001）。出典: §6.5 JSON例。"
    },
    "steps": {
      "type": "array",
      "items": { "type": "string" },
      "description": "実行手順。出典: §6.5 JSON例。"
    },
    "expected_results": {
      "type": "array",
      "items": { "type": "string" },
      "description": "期待結果一覧。出典: §6.5 JSON例。"
    },
    "priority": {
      "type": "string",
      "description": "優先度（例: high）。出典: §6.5 JSON例。列挙値は出典に明記がないため自由文字列とした。"
    }
  },
  "required": ["id", "coverage_item_refs", "steps", "expected_results"],
  "additionalProperties": false
}
