{
  "id": "TC-001",
  "coverage_item_refs": [
    "COV-001"
  ],
  "preconditions": [
    "有効な購入者アカウントでログインしている",
    "決済事業者スタブが初回応答をタイムアウトする"
  ],
  "test_data_refs": [
    "TD-001"
  ],
  "steps": [
    "決済を確定する",
    "タイムアウト後に同じ冪等性キーで再送する"
  ],
  "expected_results": [
    "注文が一度だけ確定する",
    "請求レコードが一件だけ作成される"
  ],
  "priority": "high"
}
